{
  "schema_version": 1,
  "lock_version": "1.3.0",
  "first_approved_date": "2026-07-23",
  "last_verified_date": "2026-07-24",
  "records": [
    {
      "name": "semgrep-ce",
      "kind": "scanner",
      "purpose": "Source-code exploit patterns using Toolkit-owned rules",
      "upstream": "semgrep/semgrep",
      "publisher": "semgrep",
      "release": "v1.171.0",
      "commit": "6e47ff626670a8bded8b527f61d709e2e332ec4b",
      "license": "LGPL-2.1-only",
      "license_file": "LICENSE",
      "license_sha256": "20c17d8b8c48a600800dfd14f95d5cb9ff47066a9641ddeab48dc54aec96e331",
      "commercial_use": "approved",
      "redistribution": "conditional_lgpl_not_redistributed",
      "expected_release_asset": null,
      "release_checksum": null,
      "signature_attestation": null,
      "container_digest": null,
      "supported_platforms": [
        "source-build",
        "python-package"
      ],
      "output_schema": "semgrep-json",
      "rules_database_version": "toolkit-rules-1.3.0",
      "adoption_decision": "DEFER",
      "state": "blocked",
      "reason": "Official GitHub release publishes no immutable binary and checksum asset; restricted Semgrep-maintained rules are excluded."
    },
    {
      "name": "trivy",
      "kind": "scanner",
      "purpose": "Filesystem dependency, secret-supporting, Docker/IaC and misconfiguration scanning",
      "upstream": "aquasecurity/trivy",
      "publisher": "aquasecurity",
      "release": "v0.72.0",
      "commit": "8a32853686209a428179bb3a1688802b25691564",
      "license": "Apache-2.0",
      "license_file": "LICENSE",
      "license_sha256": "c71d239df91726fc519c6eb72d318ec65820627232b2f796219e87dcf35d0ab4",
      "commercial_use": "approved",
      "redistribution": "approved_with_notice_not_redistributed",
      "expected_release_asset": "trivy_0.72.0_Linux-64bit.tar.gz",
      "release_checksum": "bbb64b9695866ce4a7a8f5c9592002c5961cab378577fa3f8a040df362b9b2ea",
      "asset_url": "https://github.com/aquasecurity/trivy/releases/download/v0.72.0/trivy_0.72.0_Linux-64bit.tar.gz",
      "signature_attestation": "sigstore bundle trivy_0.72.0_Linux-64bit.tar.gz.sigstore.json published by aquasecurity/trivy",
      "container_digest": null,
      "supported_platforms": [
        "linux-x64",
        "linux-arm64",
        "windows-x64",
        "macos-x64",
        "macos-arm64",
        "freebsd-x64"
      ],
      "output_schema": "trivy-json",
      "rules_database_version": "trivy-db schema 2; current database required in scheduled/release mode",
      "adoption_decision": "ADOPT",
      "state": "active"
    },
    {
      "name": "osv-scanner",
      "kind": "scanner",
      "purpose": "Dependency and lockfile vulnerability cross-check",
      "upstream": "google/osv-scanner",
      "publisher": "google",
      "release": "v2.4.0",
      "commit": "b56b5191101d5f27d4787d5583d8d01e9518a7af",
      "license": "Apache-2.0",
      "license_file": "LICENSE",
      "license_sha256": "cfc7749b96f63bd31c3c42b5c471bf756814053e847c10f3eb003417bc523d30",
      "commercial_use": "approved",
      "redistribution": "approved_with_notice_not_redistributed",
      "expected_release_asset": "osv-scanner_linux_amd64",
      "release_checksum": "15314940c10d26af9c6649f150b8a47c1262e8fc7e17b1d1029b0e479e8ed8a0",
      "asset_url": "https://github.com/google/osv-scanner/releases/download/v2.4.0/osv-scanner_linux_amd64",
      "signature_attestation": "multiple.intoto.jsonl SLSA provenance published by google/osv-scanner",
      "container_digest": null,
      "supported_platforms": [
        "linux-x64",
        "linux-arm64",
        "windows-x64",
        "windows-arm64",
        "macos-x64",
        "macos-arm64"
      ],
      "output_schema": "osv-scanner-v2-json",
      "rules_database_version": "OSV.dev query state at execution; freshness required",
      "adoption_decision": "ADOPT",
      "state": "active"
    },
    {
      "name": "zizmor",
      "kind": "scanner",
      "purpose": "GitHub Actions attack-surface analysis",
      "upstream": "zizmorcore/zizmor",
      "publisher": "zizmorcore",
      "release": "v1.28.0",
      "commit": "4381cc6339bb76a1004a99da929fe8f8f1143d94",
      "license": "MIT",
      "license_file": "LICENSE",
      "license_sha256": "a6fd1bd18da7cec8284639d5b0d351b90934317be1b9f9ea94a077621c6f35af",
      "commercial_use": "approved",
      "redistribution": "approved_with_notice_not_redistributed",
      "expected_release_asset": "zizmor-x86_64-unknown-linux-gnu.tar.gz",
      "release_checksum": "e87b67160194884e375a46a12c57ccc904f762b53845f254fab7f17d98809c09",
      "asset_url": "https://github.com/zizmorcore/zizmor/releases/download/v1.28.0/zizmor-x86_64-unknown-linux-gnu.tar.gz",
      "signature_attestation": null,
      "container_digest": null,
      "supported_platforms": [
        "linux-x64",
        "linux-arm64",
        "windows-x64",
        "macos-x64",
        "macos-arm64"
      ],
      "output_schema": "zizmor-json",
      "rules_database_version": "builtin-v1.28.0",
      "adoption_decision": "ADOPT",
      "state": "active"
    },
    {
      "name": "actionlint",
      "kind": "scanner",
      "purpose": "GitHub Actions syntax and expression analysis",
      "upstream": "rhysd/actionlint",
      "publisher": "rhysd",
      "release": "v1.7.12",
      "commit": "914e7df21a07ef503a81201c76d2b11c789d3fca",
      "license": "MIT",
      "license_file": "LICENSE.txt",
      "license_sha256": "03a26b06d224380a02bf100e05fff3b2dfc71b14d4e2fa685ec9963a87563c22",
      "commercial_use": "approved",
      "redistribution": "approved_with_notice_not_redistributed",
      "expected_release_asset": "actionlint_1.7.12_linux_amd64.tar.gz",
      "release_checksum": "8aca8db96f1b94770f1b0d72b6dddcb1ebb8123cb3712530b08cc387b349a3d8",
      "asset_url": "https://github.com/rhysd/actionlint/releases/download/v1.7.12/actionlint_1.7.12_linux_amd64.tar.gz",
      "signature_attestation": null,
      "container_digest": null,
      "supported_platforms": [
        "linux-x64",
        "linux-arm64",
        "windows-x64",
        "windows-arm64",
        "macos-x64",
        "macos-arm64",
        "freebsd-x64"
      ],
      "output_schema": "actionlint-json-lines-template-v2-canonical",
      "rules_database_version": "builtin-v1.7.12",
      "transitive_tools": [
        {
          "name": "shellcheck",
          "selection": "-shellcheck",
          "required": true
        }
      ],
      "adoption_decision": "ADOPT",
      "state": "active"
    },
    {
      "name": "owasp-zap",
      "kind": "scanner",
      "purpose": "Passive and active web/API dynamic analysis",
      "upstream": "zaproxy/zaproxy",
      "publisher": "zaproxy",
      "release": "v2.17.0",
      "commit": "8a1bff313f4d183dba5aa154ecbe89ad751c9153",
      "license": "Apache-2.0",
      "license_file": "LICENSE",
      "license_sha256": "b40930bbcf80744c86c46a12bc9da056641d722716c378f5659b9e555ef833e1",
      "commercial_use": "approved",
      "redistribution": "approved_with_notice_not_redistributed",
      "expected_release_asset": "ZAP_2.17.0_Crossplatform.zip",
      "release_checksum": "94c8f767b1c2e94f0db66b3ae56514d5e3f5a728ee1b6c798e0c8fe2d61fbff0",
      "asset_url": "https://github.com/zaproxy/zaproxy/releases/download/v2.17.0/ZAP_2.17.0_Crossplatform.zip",
      "signature_attestation": null,
      "container_digest": null,
      "supported_platforms": [
        "cross-platform-java",
        "linux-x64",
        "windows-x64",
        "macos-x64",
        "macos-arm64"
      ],
      "output_schema": "zap-json",
      "rules_database_version": "addons must be separately pinned",
      "adoption_decision": "DEFER",
      "state": "blocked",
      "reason": "No authorised isolated web/API target exists in the Toolkit pilot; active DAST is forbidden against production."
    },
    {
      "name": "shellcheck",
      "kind": "scanner",
      "purpose": "Shell correctness and security-supporting analysis",
      "upstream": "koalaman/shellcheck",
      "publisher": "koalaman",
      "release": "v0.11.0",
      "commit": "aac0823e6b58f8a499e856e93738082691cbf212",
      "license": "GPL-3.0-only",
      "license_file": "LICENSE",
      "license_sha256": "3972dc9744f6499f0f9b2dbf76696f2ae7ad8af9b23dde66d6af86c9dfb36986",
      "commercial_use": "approved",
      "redistribution": "conditional_gpl_not_redistributed",
      "expected_release_asset": "shellcheck-v0.11.0.linux.x86_64.tar.gz",
      "release_checksum": "b7af85e41cc99489dcc21d66c6d5f3685138f06d34651e6d34b42ec6d54fe6f6",
      "asset_url": "https://github.com/koalaman/shellcheck/releases/download/v0.11.0/shellcheck-v0.11.0.linux.x86_64.tar.gz",
      "signature_attestation": null,
      "container_digest": null,
      "supported_platforms": [
        "linux-x64",
        "linux-arm64",
        "macos-x64",
        "macos-arm64"
      ],
      "output_schema": "shellcheck-json-v1",
      "rules_database_version": "builtin-v0.11.0",
      "adoption_decision": "ADOPT",
      "state": "active"
    },
    {
      "name": "psscriptanalyzer",
      "kind": "scanner",
      "purpose": "PowerShell correctness and security-supporting analysis",
      "upstream": "PowerShell/PSScriptAnalyzer",
      "publisher": "PowerShell",
      "release": "1.25.0",
      "commit": "f05704df81b2aca17dc027ee39b3fce106d418fc",
      "license": "MIT",
      "license_file": "LICENSE",
      "license_sha256": "646f8936b8ddcd14e13e578ff6857e368780b0d1a4f6066bee89211923a373e2",
      "commercial_use": "approved",
      "redistribution": "approved_with_notice_not_redistributed",
      "expected_release_asset": "PSScriptAnalyzer.1.25.0.nupkg",
      "release_checksum": "14e634c828eb98efb9f40b2918ba90f139ed5eccdf663a2a747736d996995d60",
      "asset_url": "https://github.com/PowerShell/PSScriptAnalyzer/releases/download/1.25.0/PSScriptAnalyzer.1.25.0.nupkg",
      "signature_attestation": null,